,title,subreddit,processed_title
0,How many of you guys play multiple instruments?,musicians,guy play multiple instrument
1,"I started guitar at 33 & I am now looking back. I’m impressed with my progress of the last four years, but I cannot stop being angry at myself for not starting sooner. Anyone else with a similar predicament?",musicians,start guitar look impressed progress year stop angry start soon similar predicament
2,Tell me about the first time you got on stage (want to hear from everyone but ESPECIALLY singers),musicians,tell time get stage want hear especially singer
3,Think less about what fans can do for you:,musicians,think fan
4,“Feeling the music”,musicians,feel music
5,"Im building an app for discovering and exploring geographically based content. More than anything, when people drive they want to listen to music. Would you, as an artist, be willing to give your input on an app such as this?",musicians,build app discover explore geographically base content people drive want listen music artist willing input app
6,Exciter - Destructor Bass Cover,musicians,exciter destructor bass cover
7,Take care of your hands,musicians,care hand
8,Looking to hear some thoughts about me music. I'd love to know what you think! ,musicians,look hear thought music love know think
9,Harson Robkus. That's in Shields. (Official Music Video),musicians,harson robkus shields official music video
10,Changing up gig habits,musicians,change gig habit
11,I auditioned for a band and I’m confused,musicians,audition band confused
12,Any percussionists in CT looking for an act? Details In body.,musicians,percussionist ct look act detail body
13,Growing Fans After Gigs,musicians,grow fans gig
14,I was a musician,musicians,musician
15,I messed up accepting an unpaid gig. How do I move forward? ,musicians,mess accept unpaid gig forward
16,Willing to collaborate on catchy pop songs ,musicians,will collaborate catchy pop song
17,Looking to gig San Diego!,musicians,look gig san diego
18,"Learned guitar 2 years ago, released album with members of Pearl Jam and New Found Glory, ama",musicians,learn guitar year ago release album member pearl jam new found glory ama
19,Take breaks. 99 steps forward and 98 steps backwards is still 1 step forward. I’m so close to finishing a song and it’s getting harder and harder to admit when something is good enough to stop. To reiterate to anyone else feeling the same way: take breaks. ,musicians,break step forward step backwards step forward close finish song get hard hard admit good stop reiterate feel way break
20,Dealing with being a professional musician,musicians,deal professional musician
21,Being in a band is hardly worth the stress. Should I take break from music?,musicians,band hardly worth stress break music
22,"Singers, instrumentalists and song writers needed!!",musicians,singer instrumentalist song writer need
23,Looking for artists,musicians,look artist
24,Singer/Songwriter needing some guidance!,musicians,singer songwriter need guidance
25,EVH 5150 iconic 40w combo ohms impedance matching questions,musicians,evh iconic combo ohms impedance matching question
26,ways to promote your music?,musicians,way promote music
27,New Artist,musicians,new artist
28,Jimmy Reed Style Chicago blues shuffle backing track | Guitar & Harmonic...,musicians,jimmy reed style chicago blue shuffle backing track guitar harmonic
29,Tips on Radio Promotions,musicians,tip radio promotions
30,Seeking Paid Band Members for Hard Rock/Alternative Rock/Metal Group,musicians,seek paid band member hard rock alternative rock metal group
31,"Musicians who play every instrument in the band - I made a sub for this type of ""one-man-band""",musicians,musician play instrument band sub type man band
32,"I hit over 50k monthly listeners on Spotify in under 2 years as a fully independent artist!! Most people didn’t believe I could do it…and even I doubted myself and wanted to give up many times, but I’m really glad I didn’t! :)",musicians,hit monthly listener spotify year fully independent artist people believe doubt want time glad
33,Talent show,musicians,talent
34,Looking for female singer to collaborate and topline on a song,musicians,look female singer collaborate topline song
35,Rock and Roll Hall of Fame 2024 Inductees - It's About Time,musicians,rock roll hall fame inductees time
36,38 Young & Beautiful Elvis Presley Cover by Damien Daigneau,musicians,young beautiful elvis presley cover damien daigneau
37,37 When You Were Young The Killers cover by The Short Fall Music,musicians,young killers cover short fall music
38,How Do You Get A Cruise Ship Gig?,musicians,cruise ship gig
39,Discord for artists and producers to network ,musicians,discord artist producer network
40,Rant for the multi-instrumentalists ,musicians,rant multi instrumentalist
41,Biden Signs TikTok Ban Bill: How does a TikTok ban effect artists?,musicians,biden sign tiktok ban bill tiktok ban effect artist
42,People asking to sing on stage when playing live,musicians,people ask sing stage play live
43,Yesterday - Instrumental Bass Cover,musicians,yesterday instrumental bass cover
44,Is it possible to commission a musician to record a piece ?,musicians,possible commission musician record piece
45,soloists with anxiety,musicians,soloist anxiety
46,TikTok/social links,musicians,tiktok social link
47,Your favorite portable (pocket-size) non-reed instrument for suggestions? ,musicians,favorite portable pocket size non reed instrument suggestion
48,Can I perform one song?,musicians,perform song
49,"pssst, wanna learn BLUES!?-The MYSTERY IN THE HISTORY",musicians,pssst wanna learn mystery history
50,Carrer in music?,musicians,carrer music
51,What am I doing wrong?,musicians,wrong
52,Bangers on deck ,musicians,banger deck
53,"How Much to Charge for 2hrs Live in Boston, MA?",musicians,charge live boston ma
54,Looking for a guitarist with an artistic mind for a band (we'd prefer someone younger),musicians,look guitarist artistic mind band prefer young
55,I want to do a cruise ship contract next year. Anyone here with experience as a showband/theatre musician?,musicians,want cruise ship contract year experience showband theatre musician
56,this is my latest song let me know what you think,musicians,late song let know think
57,Should I learn to play the Oboe?,musicians,learn play oboe
58,"Hello to all the Pop lovers out there! I just released my new song, I'm sure you'll enjoy it!",musicians,hello pop lover release new song sure enjoy
59,I’m able to cut 90% of my apartment reverb noise with this set up,musicians,able cut apartment reverb noise set
60,Drummer needing band,musicians,drummer need band
61,Unfinished basement rehearsal space Photos,musicians,unfinished basement rehearsal space photo
62,"Hi friends! 🎠 This is my new ""Angela's Waltz"" for my daughter, played in Germany by pianist Valeriya Kizka. 🎹 Please read about Valeriya in the Video Description on YouTube! ...Peace! 🎼❤☮",musicians,hi friend new angela waltz daughter play germany pianist valeriya kizka read valeriya video description youtube peace
63,Would you back someone who isn't very good? ,musicians,good
64,Band mate has “allegations” against him,musicians,band mate allegation
65,Help with a composition,musicians,help composition
66,Bad on stage,musicians,bad stage
67,What do you think? All critiques are welcome :),musicians,think critique welcome
68,Marijuana + Music,musicians,marijuana music
69,FRESH VISION INK,musicians,fresh vision ink
70,Outdoor gig in rough weather advice,musicians,outdoor gig rough weather advice
71,What things helped you the most improve singing voice?,musicians,thing help improve singing voice
72,"My first show! @ an open mic. Would love to get a drummer and get a band going. Sped up quite a bit, I was nervous, but I could practice with a metronome to get it right.",musicians,open mic love drummer band go sped bit nervous practice metronome right
73,DAWs,musicians,daw
74,How to get a manager?,musicians,manager
75,I curated a playlist in Spotify with my favourites Israeli rock musicians. Hope you’ll like it. Would love to hear suggestions.,musicians,curate playlist spotify favourite israeli rock musician hope like love hear suggestion
76,Looking for a male vocalist who can perform acapella harmonies. Calgary Alberta Canada ,musicians,look male vocalist perform acapella harmony calgary alberta canada
77,"Always a little bit shy and anxious about my voice, tell me is it worth to keep trying",musicians,little bit shy anxious voice tell worth try
78,Trying to learn some classic rock solos lately. Here is my attempt at Stairway to Heaven. Feedback?,musicians,try learn classic rock solo lately attempt stairway heaven feedback
79,Looking for hair metal singer Ventura County (SoCal),musicians,look hair metal singer ventura county socal
80,Xloudy - Stephen Hawking (Dir. Eric Svensson),musicians,xloudy stephen hawking dir eric svensson
81,Send your song! I'm making playlists for underground indieish musicians/bands,musicians,send song make playlist underground indieish musicians band
82,Should I give up music because my finger is not straight?,musicians,music finger straight
83,Looking for a female to collaborate with.,musicians,look female collaborate
84,can you help me use this sound recording rate chart?,musicians,help use sound recording rate chart
85,"I dabbled in AI music generation, I thinks it's pretty neat",musicians,dabble ai music generation think pretty neat
86,TONEX One review & tone demo,musicians,tonex review tone demo
87,chris webby x earthgang type beat,musicians,chris webby earthgang type beat
88,"A Modern Piano Improvisiation, I hope you enjoy it :) ",musicians,modern piano improvisiation hope enjoy
89,Loop Earplugs for Live suggestions,musicians,loop earplugs live suggestion
90,Just sent out my first gig inquiries for the first band I've fronted,musicians,send gig inquiry band front
91,How do I tell my band members we should put value to our music and charge for shows,musicians,tell band member value music charge show
92,"If you were forced to rename your band, what would you call it?",musicians,force rename band
93,Highschooler making music,musicians,highschooler make music
94,"New episode of Oh sheet! We touched on so many cool topics like the differences between video game music vs classical, prejudice in classical musicians towards vgm players, influencer musicians vs concert artists and many more :)",musicians,new episode oh sheet touch cool topic like difference video game music vs classical prejudice classical musician vgm player influencer musician vs concert artist
95,How to overcome preshow anxiety ??? Fear of shitting my pants on stage,musicians,overcome preshow anxiety fear shit pant stage
96,Sync library doesn’t respond ,musicians,sync library respond
97,My First EP! Sharing for the first time!,musicians,ep share time
98,Tiptoe Through the Tulips,musicians,tiptoe tulips
99,Record Labels for Metalcore / Prog Metal /Djent,musicians,record labels metalcore prog metal
100,People who want to chat on the phone about playing before we play,musicians,people want chat phone play play
101,Musicians with Tinnitus,musicians,musician tinnitus
102,Need a guitarist to finish a song ,musicians,need guitarist finish song
103,Do I need this for a no p . A practice?,musicians,need practice
104,I write mix and master my bands music. Could be down to expand on some questions if I get any! ,musicians,write mix master band music expand question
105,What is the BPM for Iphones ringtone “chirp”,musicians,bpm iphones ringtone chirp
106,Private guitar teacher: What can I claim on my taxes without inviting an audit?,musicians,private guitar teacher claim taxis invite audit
107,Looking for drummer - alt rock funk indie - Savannah Ga,musicians,look drummer alt rock funk indie savannah ga
108,The future of music ,musicians,future music
109,Looking for musicians in Charleston and the surrounding areas.,musicians,look musician charleston surround area
110,College Help,musicians,college help
111,How can I start content creating as a guitarist?,musicians,start content create guitarist
112,Can someone please help with a band name?,musicians,help band
113,I'm worried about not knowing everything,musicians,worried know
114,Licensing your music in germany,musicians,license music germany
115,"For any country musicians, Becky Gardenhire (co-head of WME nashville) is taking questions over here",musicians,country musician becky gardenhire co head wme nashville take question
116,CA$ANOVA - SZOZA,musicians,szoza
117,How have the changes in music distribution affected artists?,musicians,change music distribution affect artist
118,Journey - Don't Stop Believing (Live Looping - Acoustic Cover),musicians,journey stop believe live looping acoustic cover
119,ASPIRING DIGITAL MUSICANS DISCORD (MODS NEEDED). If not allowed please delete. Trying to bring us together to collab and hangout.,musicians,aspiring digital musican discord mods needed allow delete try bring collab hangout
120,"London - Drummer/collaborator wanted for live Drum & Bass, Jungle, Electronics, Noise ",musicians,london drummer collaborator want live drum bass jungle electronics noise
121,Lament Of The Valkyrie - Epic Original Song,musicians,lament valkyrie epic original song
122,Zinkstar,musicians,zinkstar
123,I play rhythm guitar and I am taking vocal lessons. I am looking for a bud to talk music advice with. Doesn’t matter what instrument you play.,musicians,play rhythm guitar take vocal lesson look bud talk music advice matter instrument play
124,Zinkstar,musicians,zinkstar
125,Help with click track! ,musicians,help click track
126,Kat Hasty - The Best We Can (Country),musicians,kat hasty best country
127,How do you deal with creepy comments from people?,musicians,deal creepy comment people
128,Artist Development Consultancy,musicians,artist development consultancy
129,Most common lie?,musicians,common lie
130,House shows with grumpy neighbor,musicians,house show grumpy neighbor
131,Zinkstar,musicians,zinkstar
132,Do you have to be close friends with your band mates?,musicians,close friend band mate
133,"Possibility music got stolen?
",musicians,possibility music get steal
134,Moving To Another Music Distribution,musicians,move music distribution
135,"Would this be something other bands or musicians would use or be interested in? Of course, they'd have to be using Excel....",musicians,band musician use interested course excel
136,How to Let Go of Negative Experiences that Made You Lose Faith in Playing? ,musicians,let negative experience lose faith playing
137,Some ideas for what to do daily when trying build a career?,musicians,idea daily trying build career
138,Dealing with post gig soreness?,musicians,deal post gig soreness
139,Merch— ordering tshirs made versus DIY screen printing,musicians,merch order tshir versus diy screen printing
140,Help?,musicians,help
141,If I make an anagram band name (i.e. AFI: A Fire Inside) do I have to trademark both the anagram and the words?,musicians,anagram band afi fire inside trademark anagram word
142,"Should I release very racy, heartfelt songs under a new artist name, or my existing one?",musicians,release racy heartfelt song new artist exist
143,Don Toliver Type Beat | Free Download,musicians,don toliver type beat free download
144,What do you use to keep track of the steps to take to be able to release music?,musicians,use track step able release music
145,what if no one buys my merch but I have fans who come to shows and listeners?,musicians,buy merch fan come show listener
146,"Subbed gig got rescheduled, does the sub still play the gig if i’m available?",musicians,sub gig get reschedule sub play gig available
147,Holiday Inn out Now on Everything tap in https://youtu.be/dNEic6hQBi8?si=5sO5-VgTXMBV8bJ_,musicians,holiday inn tap
148,Echoes of Absence - Pop Soul Ballad - The Silent Weight of a Lost Love,musicians,echo absence pop soul ballad silent weight lost love
149,(quality) singers are hard to come by,musicians,quality singer hard come
150,"If you could Pick five artist that would be in a overpowering band that would sweep the world, who would they be?",musicians,pick artist overpowering band sweep world
151,"UPBEAT, MINIMALISTIC SONGS?",musicians,upbeat minimalistic songs
152,"UPBEAT, MINIMALISTIC SONGS?",musicians,upbeat minimalistic songs
153,"Minimalistic, upbeat songs?",musicians,minimalistic upbeat song
158,"Almost everyone in my local music scene is bad, and I had terrible crimes happen but idk what to do?!",musicians,local music scene bad terrible crime happen idk
159,does this article seem to be written by ai? did i just get scammed by groover?,musicians,article write ai scamme groover
160,María Andrea creating music with a looper,musicians,maría andrea create music looper
161,Significant other upset at me for shows my band plays at and people try to hug me,musicians,significant upset show band play people try hug
162,Looking for a drummer in the Oxford area,musicians,look drummer oxford area
163,Drummer looking to play,musicians,drummer look play
164,"If music made a lot more money, would you pursue it as a career?",musicians,music lot money pursue career
165,"Seeking small keyboard to add bass, solos, etc.",musicians,seek small keyboard add bass solo etc
166,resinonmylips - bag of dope,musicians,resinonmylip bag dope
167,"Hi friends! 📯 This is a live concert audio and fun photo video of my ""Ogre and the Maiden"" with the Octava Orchestra in Seattle Washington from 2023! 🎻 Thanks for listening! ... Peace! 🎼❤☮",musicians,hi friend live concert audio fun photo video ogre maiden octava orchestra seattle washington thank listen peace
170,How is there no echo on mic live,musicians,echo mic live
171,Server or cloud use to save and 'share' DAW files,musicians,server cloud use save share daw file
172,"Feel a cold coming on before a performance, panicking, please help!",musicians,feel cold come performance panic help
173,hello ,musicians,hello
174,Follow click track or the drummer?,musicians,follow click track drummer
175,Marketing for Spotify songs? Advice?,musicians,marketing spotify song advice
176,I just got my first e drum kit. How is the best way to start learning?,musicians,get drum kit good way start learn
177,Does production seem robotic to anyone?,musicians,production robotic
178,How do I know if I can be a musician?,musicians,know musician
179,How do i get fill-in gigs?,musicians,fill gig
180,Marketing strategy for long term streams/listeners,musicians,marketing strategy long term stream listener
181,I am willing to help in your musical project,musicians,willing help musical project
182,"Sphinx Virtuosi perform #SUBMERGED by Migguel del Aguila at New World Center Miami Beach, FL - April Tiesday 23, 2024 at 7:30 PM Sphinx Virtuosi | Miguel del Aguila",musicians,sphinx virtuosi perform submerged migguel del aguila new world center miami beach fl april tiesday pm sphinx virtuosi miguel del aguila
183,Streaming Platforms,musicians,streaming platforms
184,Looking for serious collaboration 😁😁😁,musicians,look collaboration
185,Survey for College,musicians,survey college
186,Survey: how do you study songs and artists to influence your own music?,musicians,survey study song artist influence music
187,Dent in the grill of SM58,musicians,dent grill
188,Can I connect my audiocard to this to feed it backing tracks? (along with microphone vocals).,musicians,connect audiocard feed back track microphone vocal
189,Can you claim royalties by making backing tracks?,musicians,claim royalty make backing track
190,Is this legit? Person wants to write a music blog for me. Idk if it's a scam,musicians,legit person want write music blog idk scam
191,"I want to make beats/electronic music with midi controller, what do I need?",musicians,want beat electronic music midi controller need
192,"Considering traveling in Mexico City. Anyone know of any music communities, music studios, music events that are open to foreigners (from the US)",musicians,consider travel mexico city know music community music studio music event open foreigner
193,"One member of the band is so bad that he's dragging everyone down, but he's also a good friend. How Can I handle this ?",musicians,member band bad drag good friend handle
194,"Hello electronic music fans! We've crafted something special in our home studio—an improvised electronic session just for you. Thanks for your support on this musical journey. More surprises ahead, so stay tuned!",musicians,hello electronic music fan craft special home studio improvise electronic session thank support musical journey surprise ahead stay tune
195,"How do PA systems, and in effect my approach to them differ from bar to bar?",musicians,pa system effect approach differ bar bar
196,Drummer available for recordings ,musicians,drummer available recording
197,"Hi friends! 📯 Please watch in May for the live performance video of my ""Requiem For Lost Loves"" with the Budapest Symphony, and in July for the live orchestra premiere video of my ""Symphonic Dances"" with the Octava Orchestra in Seattle! 🎻... Peace and Love! 🎼❤☮",musicians,hi friend watch live performance video requiem lost love budapest symphony july live orchestra premiere video symphonic dance octava orchestra seattle peace love
198,"Hello! I finally released a rock song called ""Like a Dream"". Would love for you guys to check it out. And tell me what you think.",musicians,hello finally release rock song call like dream love guy check tell think
199,"What's the most budget friendly PA to mix in vocals, and backing tracks?",musicians,budget friendly pa mix vocal back track
200,Is there any plugins similar to this pedal? EBS multi comp blue label,musicians,plugin similar pedal ebs multi comp blue label
201,Are there simple manual tools with which you can endlessly loop a synthesizer?,musicians,simple manual tool endlessly loop synthesizer
202,Looking for someone that lives in vegas and plays lead guitar,musicians,look live vegas play lead guitar
203,Is this a scam? Need help,musicians,scam need help
204,Young Kawasaki [Lo-Fi Type Beat by MK7357],musicians,young kawasaki lo fi type beat
205,Streaming Music on Twitch,musicians,streaming music twitch
206,looking for a female punk chick to lay some sick vox on a character track for my comic!,musicians,look female punk chick lay sick vox character track comic
207,Looking for a mentor? ,musicians,look mentor
208,Where to find band mates?  Craigslist is full of flakes,musicians,find band mate craigslist flake
209,Music for literature ? ,musicians,music literature
210,Music about exes is so overrated,musicians,music ex overrated
211,What do you think about sampling AI music?,musicians,think sample ai music
212,Alice In Chains - Down In A Hole Acoustic Cover with me on vocals,musicians,alice chains hole acoustic cover vocal
213,Tips and instrument rec’s for Encouraging a Budding Musician,musicians,tip instrument rec encourage budding musician
214,Best way for a background video during live performances,musicians,good way background video live performance
215,"What are some tips for no-name bands when it comes to pitching bars, and restaurants gigs?",musicians,tip band come pitching bar restaurant gig
216,new dropped “vols”,musicians,new drop vol
217,Achieving sophisticated yet minimalistic sound?,musicians,achieve sophisticated minimalistic sound
218,Where are drummers getting the best deal on heads these days?,musicians,drummer get good deal head day
219,This is the first song I've ever put on social media and I would like feedback. Ive been producing for like 5 years.,musicians,song social medium like feedback ve produce like year
220,EsoterixGoddess - Daydreamin’ (Official Visualizer) [Erotixa Core 🫶🏾🩷],musicians,esoterixgoddess daydreamin official visualizer erotixa core
221,Did you ever be in a band? How was the experience?,musicians,band experience
222,"Hello fellow musicians, I'm an illustrator and my focus is illustrating musicians and music lovers. If you are interested in having an illustration of you or your band, talk to me. see some of my work. illustrations for 50 to 60 dollars",musicians,hello fellow musician illustrator focus illustrate musician music lover interested have illustration band talk work illustration dollar
223,Spotify Study,musicians,spotify study
224,How do I make songs that sound industry standard?,musicians,song sound industry standard
225,PA System ,musicians,pa system
226,"As a listener, what’s cooler:",musicians,listener cooler
227,Any musicians out there that gig and are parents and also have full-time jobs?,musicians,musician gig parent time job
228,Feeling Discouraged,musicians,feel discouraged
229,I don't know if I'm a good enough composer,musicians,know good composer
230,College decisions...,musicians,college decision
231,"Solo artists: what's better--your own name, a pseudonym, or a ""band"" name? ",musicians,solo artist well pseudonym band
232,How long prior to your gig do you start promoting your gig? ,musicians,long prior gig start promote gig
233,Why do venues make the opener sound bad,musicians,venue opener sound bad
234,9 months on the oboe,musicians,month oboe
235,Best colors for merch for males? Like TV shirts etc ,musicians,good color merch male like tv shirt etc
236,Who are the guitarist and bassist punching bags?,musicians,guitarist bassist punch bag
237,Would anyone be interested in exploring our platform? (platform to help musicians get more listens/follows),musicians,interested explore platform platform help musician listen follow
238,Overthrow Ent. - Reefers,musicians,overthrow ent reefers
239,Is 24 too ‘old’ to make it as a mainstream artist?,musicians,old mainstream artist
240,Moving to NYC as a musish - pros and cons?,musicians,move nyc musish pro con
