,title,subreddit,processed_title
205,Does anyone know who they are? Mad skills yo!,DJs,know mad skill yo
206,Always double check your USB before your set.,DJs,double check usb set
207,DJs: you need to say no to gigs if they're not safe,DJs,djs need gig safe
208,Ekali's explaining the different subgenres of electronic music,DJs,ekali explain different subgenre electronic music
209,Thank you beatport for the cool ads…,DJs,thank beatport cool ad
210,What dual deck turntables looked like...100+ years ago,DJs,dual deck turntable look like year ago
211,Being a drug free DJ and having residency at the local nightclub...,DJs,drug free dj have residency local nightclub
212,My dads been a DJ for over 35 years and he’s the coolest person I know.,DJs,dad dj year cool person know
213,Thought about it for months. No buyers remorse here.,DJs,thought month buyer remorse
214,Thank Brexit...,DJs,thank brexit
215,Excellent footage of grimes fucking up,DJs,excellent footage grime fuck
216,Peep this dope photo I got of A-Trak!,DJs,peep dope photo get trak
217,Just a friendly reminder to avoid heat sources and sunny windows for your beloved record collection! 🤦🏻,DJs,friendly reminder avoid heat source sunny window beloved record collection
218,"Quick tone-play routine. I tried it out this weekend, and it translated really well.",DJs,quick tone play routine try weekend translate
219,On the plus side....,DJs,plus
220,looks kinda groovy,DJs,look kinda groovy
221,They were able to raise about 7k last I checked. Thought these guys deserved a shoutout here too.,DJs,able raise check thought guy deserve shoutout
222,Someone has fell asleep on their DJ live stream and is now at 2k live viewers,DJs,fall asleep dj live stream live viewer
223,Provided by the venue. What a night. Thank you Lost & Found OTR.,DJs,provide venue night thank lost found otr
224,Just landed my first residency ! So happy to see all the hard work pay off! Thanks to all the DJs in this sub for sharing knowledge and helping me learn more everyday!,DJs,land residency happy hard work pay thank dj sub share knowledge help learn everyday
225,Essential new gear for those 4+ hour sets 😂,DJs,essential new gear hour set
226,**/r/DJs NEW RULES** Please read before posting,DJs,djs new rule read post
227,We had a lot of fun with our little set-up during the last roadtrip!,DJs,lot fun little set roadtrip
228,"Everything a DJ hates, mashed into 90 seconds [x-post from /r/DJsCircleJerk]",DJs,dj hate mash second post djscirclejerk
229,Found this in r/iphonewallpapers,DJs,find iphonewallpaper
230,Pioneer DJ mini collection in Japan,DJs,pioneer dj mini collection japan
231,For all you vinyl lovers: Vinyl record under 1000x magnification,DJs,vinyl lover vinyl record magnification
232,Opening for Macklemore & Chris Tucker.,DJs,open macklemore chris tucker
233,Had some scrap Walnut at work. Made a thing.,DJs,scrap walnut work thing
234,"Had no where to play, Made my own",DJs,play
235,Man went mad,DJs,man go mad
236,"Meanwhile, at the record store",DJs,record store
237,Folamour drops ABBA mid set,DJs,folamour drop abba mid set
238,One of my old videos just hit 10 Million views! Currently buzzing!,DJs,old video hit million view currently buzz
239,"pro tip: if you're going to wear a mask, make sure you can see out of it! One of the most fun gigs I've ever played, but it was a pain",DJs,pro tip go wear mask sure fun gig play pain
240,Fantastic mobile DJ playing music in the streets in Sydney today.,DJs,fantastic mobile dj playing music street sydney today
241,It may finally be time to hang up my headphones...,DJs,finally time hang headphone
242,Popular opinion: You hire a DJ. Not a spotify playlist.,DJs,popular opinion hire dj spotify playlist
243,My DJ booth this weekend was something very special...,DJs,dj booth weekend special
244,$2.87 headset hanger at walmart,DJs,headset hanger walmart
245,I spent the past couple of years creating a realistic and authentic simulation of DJing with vinyl in VR. Today it’s finally finished!,DJs,spend past couple year create realistic authentic simulation dj vinyl vr today finally finish
246,The music is better than you think it is.,DJs,music well think
247,I built a wooden turntable for my niece her second birthday. I did barter it for some backstage passes for ADE 2038 though.,DJs,build wooden turntable niece second birthday barter backstage pass ade
248,Look what I scored for a hundred euros,DJs,look score euro
249,"Just had my first session in a local club, so proud of myself right now",DJs,session local club proud right
250,"1 Traktor controller, 1 generator, and 100 sets of wireless headphones later...",DJs,traktor controller generator set wireless headphone later
251,Grand Wizzard Theodore played at my work last night for like 20 people. I felt like this belonged here.,DJs,grand wizzard theodore play work night like people feel like belong
252,"Reminder to back up your music and crates, friends. 😎",DJs,reminder music crate friend
253,The OMNIS-DUO is targeted for trust fund kids who casually DJ for TikTok.,DJs,omnis duo target trust fund kid casually dj tiktok
254,Guy scrubs like a God,DJs,guy scrub like god
255,DOOM running on a Pioneer XDJ-RX2,DJs,doom run pioneer xdj
256,Controller or Cake ???,DJs,controller cake
257,Mad MPC skills,DJs,mad mpc skill
258,B2B rulebook,DJs,rulebook
259,Mel Gibson's spaceship controller in Machete Kills,DJs,mel gibson spaceship controller machete kill
261,This is absolutely tragic,DJs,absolutely tragic
262,Doesn’t this feel like SOOOO many gigs?,DJs,feel like soooo gig
263,When I tell the DJ to stop redlining the mixer,DJs,tell dj stop redline mixer
264,Thoughts from a nobody that never became anyone,DJs,thought
265,"Why Pioneer, Why?!",DJs,pioneer
266,"Garrett Lockhart, also known as i_o, has passed away",DJs,garrett lockhart know pass away
267,I found a freaking Easter egg today when working on my Xone 3D (mirrored pic),DJs,find freak easter egg today work xone mirror pic
268,The Gordo / Carnage response… twitter’s response was brutal,DJs,gordo carnage response twitter response brutal
269,"It’s not much, but after 7 years of traveling for my love of music and attending countless shows, I decided to pick up my first controller. Traktor S2 Mk3",DJs,year travel love music attend countless show decide pick controller traktor
270,Just a bedroom DJ trying to get my first club gig but don't how to respond to this?,DJs,bedroom dj try club gig respond
271,He always goes B2B.,DJs,go
272,I create and design virtual stages and environments for DJ’s,DJs,create design virtual stage environment dj
273,You wish,DJs,wish
274,"Knife Party's Mixmag CD, awesome title.",DJs,knife party mixmag cd awesome title
275,Is anyone else a DJ but not a club person?,DJs,dj club person
276,"$17,000 doesn't go as far as it used too... (Aus)",DJs,far aus
277,Tonight I had someone I’d never met come up to me and say they came out to the show tonight just to watch me play,DJs,tonight meet come come tonight watch play
278,R.I.P. Numark DM2002X. I thought I could save you. Thank you for 20 years of service. I loved you.,DJs,numark think save thank year service love
279,"My very first set up a Pioneer DDJ SB 3, I am so excited.",DJs,set pioneer ddj sb excited
280,"Scored a pretty sweet gig DJing on the beach in Cannes throughout this week, took a couple of little videos today, here’s a bit of one",DJs,score pretty sweet gig djing beach cannes week take couple little video today bit
281,Excerpt from How to DJ right: the Art and Science of Playing Records,DJs,excerpt dj right art science play records
282,Allen & Heath Xone mixer/controller history.,DJs,allen heath xone mixer controller history
283,"Hey DJs of Reddit, I built a tool to generate slick 'Now Playing' overlays for Live Streams that reads metadata directly off of your CDJs!",DJs,hey djs reddit build tool generate slick play overlay live stream read metadata directly cdj
284,Cool YouTube quote I found that I think captures the essence of DJing.,DJs,cool youtube quote find think capture essence djing
285,Wolfgang Gartner gets DJ'ing,DJs,wolfgang gartner get
286,What are your favourite ways to deal with annoying patrons?,DJs,favourite way deal annoying patron
287,"I made a little Lego setup, a pair of 1200's and a mixer",DJs,little lego setup pair mixer
288,"DJ'd since 1997 and moved to controllers in 2012. Sold controller, gone back to vinyl. Picked up some 1200s for a decent price. Can't wait to build up my collection again.",DJs,move controller sell controller go vinyl pick decent price wait build collection
289,"Posted my Soundcloud on Reddit, looking for a chance to spin on a big art car at Burning Man. Caught flack for it, 'cause every DJ at the Burn wants that shit. But the right person heard it, and this happened. Sometimes it pays to roll the dice and ask for the gig you want.",DJs,post soundcloud reddit look chance spin big art car burning man catch flack dj burn want shit right person hear happen pay roll dice ask gig want
290,Ahh what I wish I could say to all clients..,DJs,ahh wish client
291,Local DJ and mentor of mine lost everything in a fire. Protect everything y’all!,DJs,local dj mentor lose fire protect
292,I found the worst set list of all time at my nephew's favourite play area,DJs,find bad set list time nephew favourite play area
293,Is this the most bizarre dj gear ever created?,DJs,bizarre dj gear create
294,"Saw This in the Booth for a Set I Was Panicking Before. Appreciate the Support, DJ from Gig’s Past!",DJs,saw booth set panic appreciate support dj gig past
295,The only lesson I needed,DJs,lesson need
296,I’m pretty sure I just inherited a 2000’s DJ’s absolute dream setup. What do I do now?,DJs,pretty sure inherit dj absolute dream setup
297,D'n'B Rave in a Polish Kindergarten,DJs,rave polish kindergarten
298,Helped a friend move he gave me these as payment. I don’t even know where to start as far as setup goes. Help!!,DJs,help friend give payment know start far setup go help
299,Anti-LGBT DJ gets fired from wedding; gig is possibly in my hands,DJs,anti lgbt dj get fire wedding gig possibly hand
300,"Took the Denon Prime Series to a club gig last night, was packing up and couldn’t help taking a photo of them. 😁",DJs,take denon prime series club gig night pack help take photo
301,"My first performance last night was in a barn with my best buds, feels good man",DJs,performance night barn good bud feel good man
302,When someone tells you you're not supposed to do something - remember this vid and do whatever you want.,DJs,tell suppose remember vid want
303,Test: Syncing virtual dj platters with unreal engine,DJs,test sync virtual dj platter unreal engine
304,"I took the liberty of ""fixing"" the ""We Are Your Friends"" trailer to make it a bit more 'realistic.' Enjoy.",DJs,take liberty fix friend trailer bit realistic enjoy
305,"No mobiles on the dance floor, please...",DJs,mobile dance floor
306,I've accidentally started a festival... Help me! :-D,DJs,accidentally start festival help
307,you ever seen this?,DJs,see
308,Custom Flight Cases,DJs,custom flight case
309,DJing on a budget: home-made TouchOSC controller with Mixxx!,DJs,dj budget home touchosc controller mixxx
310,"Had the opportunity to play on the coolest float in the coolest Mardi Gras parade in New Orleans, LA!",DJs,opportunity play cool float cool mardi gras parade new orleans la
311,No fucking drinks in the DJ booth!,DJs,fucking drink dj booth
312,How cool it that? 😳,DJs,cool
313,A reminder to all mobile DJs who move their own gear: take your time. I'm okay! Just bruised up and really able to admire this footage now. This could have been much worse.,DJs,reminder mobile djs gear time okay bruise able admire footage bad
314,Electronic album chart 1998,DJs,electronic album chart
315,How I became a better DJ over time.,DJs,well dj time
316,The DJ does not need a crowd...,DJs,dj need crowd
317,Baddest Wedding Cake Ever,DJs,baddest wedding cake
318,Where my vinyl junkies at?!?,DJs,vinyl junkie
319,"""My wife doesn't let me.""",DJs,wife let
320,"No slipmats, needles, records, and no clue! Nice try Smirnoff...",DJs,slipmat needle record clue nice try smirnoff
321,Sometimes you've gotta celebrate the small victories,DJs,get to celebrate small victory
322,Oldschool vibes.,DJs,oldschool vibe
323,As a DJ that plays in big open format clubs this is probably the most comprehensive party playlist I’ve seen,DJs,dj play big open format club probably comprehensive party playlist see
324,Pic of my first fully assembled Xone 3D conversion,DJs,pic fully assemble xone conversion
325,The most audiophile DJ booth I have seen,DJs,audiophile dj booth see
326,"DJing is fucking hard. Sincerely, a producer",DJs,djing fuck hard sincerely producer
327,What’s your “they didn’t know I was the DJ” story?,DJs,know dj story
328,From a Squarespace ad. Nice $2000 laptop stand he’s got there.,DJs,squarespace ad nice laptop stand get
329,"Sometimes, as DJs, we see brides party a little too hard...",DJs,dj bride party little hard
330,So my little brother made this for me 🤔,DJs,little brother
331,Little prank I love to pull in the club.,DJs,little prank love pull club
332,I just had my first gig DJing a house party and it was such an amazing experience. I'm ecstatic and it's hard to believe that just happened! Thank you /r/djs and /r/beatmatch for some super helpful advice!,DJs,gig djing house party amazing experience ecstatic hard believe happen thank djs beatmatch super helpful advice
333,"Bring pizza, not request to the DJ booth!",DJs,bring pizza request dj booth
334,Rane One. Unboxed.,DJs,rane unboxed
335,Worth noting.,DJs,worth note
336,Got myself the limited edition of the legendary dj headphones. HD25,DJs,got limited edition legendary dj headphone
337,Reunited with an old friend...q,DJs,reunite old friend
338,DJing on my scenic train ride home with my Pioneer DDJ-SR2,DJs,dj scenic train ride home pioneer ddj
339,I need to rant about a recent DJ experience DJing a house party.....,DJs,need rant recent dj experience djing house party
340,The one thing they don't tell you about being a professional DJ...,DJs,thing tell professional dj
341,Bought a DJM2000 12 years later,DJs,buy year later
342,The funniest book about DJing out there.,DJs,funny book dj
343,Ikea DJ booth,DJs,ikea dj booth
344,This might happen to you. Learn to beatmatch by ear!,DJs,happen learn beatmatch ear
345,"Damn DDJ 1000, those are some pretty thicc pads there",DJs,damn ddj pretty thicc pad
346,Couldn't be happier! Decided to switch from the DDJ-RB for that genuine-no laptop screen-feeling. Can't wait to give a proper spin! Any tips/do's/don'ts?,DJs,happy decide switch ddj rb genuine laptop screen feeling wait proper spin tip
347,Groom walked out,DJs,groom walk
348,The cruel irony of DJing is that it’s easier to play a peak-time set than a warm up. Discuss...,DJs,cruel irony djing easy play peak time set warm discuss
349,We regret to inform you that Bandcamp is union-busting,DJs,regret inform bandcamp union bust
350,I think I've found my new alias...,DJs,think find new alia
351,Found this gem in storage from back in 2000…DJing on a cruise ship that I wasn’t hired for. (We just took over the old people club),DJs,find gem storage djing cruise ship hire take old people club
352,"Kaytranads boiler room DJ set is epic, beautiful, and simply perfect",DJs,kaytranads boiler room dj set epic beautiful simply perfect
353,DJing my friends wedding and it's a beautiful day!,DJs,djing friend wed beautiful day
354,CDJ's Evolution,DJs,cdj evolution
355,"As a DJ, what would you do?",DJs,dj
356,Outdoor beach cuts - working on my double time cuts.,DJs,outdoor beach cut work double time cut
357,respect to wedding djs,DJs,respect wedding djs
358,"If you have a VR headset, you can now try out Vinyl Reality for free!",DJs,vr headset try vinyl reality free
359,"Just found this in a Techno group, I hope it’s one of you.",DJs,find techno group hope
360,"The Legendary A-Trak gives his candid view on ""Real DJing""",DJs,legendary trak give candid view real djing
361,PioneerDJ will change to AlphaTheta,DJs,pioneerdj change alphatheta
362,I did my first Boiler Room 2 days ago!,DJs,boiler room day ago
363,Spencer Brown shows Zedd how a professional handles corrupted USBs.,DJs,spencer brown show zedd professional handle corrupted usb
364,Found this at my local bar,DJs,find local bar
365,Being gifted 2 boxes full of vinyls by my uncle that was a DJ back in the 80s and 90s guess im having to buy some turntables. My current setup last picture,DJs,gift box vinyls uncle dj guess have buy turntable current setup picture
366,“Former” Event DJ here. (1000+ gigs over 20+ years). Just discovered this sub.,DJs,event dj gig year discover sub
367,"I am a medium-expert level DJ who emailed the two biggest festivals in Romania. Wish me luck, guys, i don't know what to expect!",DJs,medium expert level dj email big festival romania wish luck guy know expect
368,So this is a first… 🫠,DJs,
369,"There is no meaningful, discernible difference between 320kbps MP3s and lossless audio",DJs,meaningful discernible difference lossless audio
370,Custom Boutique Xone:92 Rotary with hollow sidepanels,DJs,custom boutique rotary hollow sidepanel
371,Always in sync!,DJs,sync
372,Unpopular opinion: DJs who don't share tracklist have no respect for the producers,DJs,unpopular opinion dj share tracklist respect producer
373,Tripped a faucet at a wedding and nearly gutted all my gear..,DJs,trip faucet wedding nearly gutte gear
374,"My nine-year-old experimenting with sampling for the first time ever with Walt Disney’s dedication of Disneyland and “Disneyland 2013” by Andreas Schuller. Not bad, kid! You’re good... with my help, you could be the best.",DJs,year old experiment sample time walt disney dedication disneyland disneyland andreas schuller bad kid good help good
375,"Rena just broke A-Trak's record for the youngest DMC World DJ Champion of all time this past weekend, here's his winning set",DJs,rena break trak record young dmc world dj champion time past weekend winning set
376,The Ministry of Sound DJ Booth back when vinyl ruled the world!,DJs,ministry sound dj booth vinyl rule world
377,djing as a woman,DJs,dj woman
378,First Gig!!!,DJs,gig
379,"**USB Tip** - Rookie DJs frequently ask me which USB is the no-doubter. I've been on the Sandisk 3.0 for years with incredible reliability and speeds. Rekordbox can be fickle, I find she likes this one.",DJs,usb tip rookie djs frequently ask usb doubter sandisk year incredible reliability speed rekordbox fickle find like
380,Is paying to play at a house party common?,DJs,pay play house party common
381,My introduction to djing 19 years ago.,DJs,introduction dj year ago
382,The worlds biggest DJ. CATCH HIM ON TOUR NOW!!!!,DJs,world big dj catch tour
383,A-Trak's 'plan B' if something goes wrong while using Phase live,DJs,trak plan go wrong phase live
384,"Guys, look at what my girlfriend made for my 20th birthday! Can you guess the model?",DJs,guy look girlfriend birthday guess model
385,So I’ve been a club dj at my university for 2 months... now I’m djing the homecoming football game! Big thanks to this subreddit!,DJs,club dj university month dj homecoming football game big thank subreddit
386,I hear it too many times,DJs,hear time
387,"Heads up, do not update to Ventura until Pioneer sorts this out…",DJs,head update ventura pioneer sort
388,Ben UFO with a small text post on learning how to DJ by ear,DJs,ben ufo small text post learn dj ear
389,Had my first headlining gig last night after opening for over a year. ‘‘Twas a Good Friday night.,DJs,headlining gig night open year twas good friday night
390,Deadmau5 voices opinion on DJ KiddLuke (Aka Worst DJ Ever),DJs,voice opinion dj kiddluke aka worst dj
391,Definitely need this,DJs,definitely need
392,"Just finished playing my first club set, and it was amazing! Thank you guys for all the tips and tricks you've taught me.",DJs,finish play club set amazing thank guy tip trick teach
393,Vinyl slipmat w moon phases + wolves,DJs,vinyl slipmat moon phase wolf
394,Setup for my halloween mix in a warehouse,DJs,setup halloween mix warehouse
395,I never know who to show when I do something like this. So I’ll put it here instead. (The power & bun up the dance),DJs,know like instead power bun dance
396,Sad day but they gave me a good 8 years. RIP.,DJs,sad day give good year rip
397,New edition just arrived and it's a frickin' tome!,DJs,new edition arrive frickin tome
398,three old boys still doing their job,DJs,old boy job
399,I received a love letter while djing at the club last night. Some people man ..,DJs,receive love letter dj club night people man
400,"PROTIP: When playing outdoors, always make sure you have enough gas in the generator for your set 🙈",DJs,protip play outdoors sure gas generator set
401,Daft Punk break up after 28 years,DJs,daft punk break year
402,Thought you'd all appreciate my Government's coronavirus ad,DJs,thought appreciate government coronavirus ad
403,"Since we're doing first setups, here's mine I got in 1997/98",DJs,setup get
404,My current DJ controller because I'm poor as all hell lol.,DJs,current dj controller poor hell lol
405,"Hey there DJs! Many of you have already voted for this project and helped pushing it towards an official LEGO set release. With the help of the community it has more than 6000 supporters so far. However, LEGO needs 10.000, so I would just share this here one more time. Thanks for your help!",DJs,hey dj vote project help push official lego set release help community supporter far lego need share time thank help
406,My dad used to DJ parties back in the day. He used this Technics SL 1200 Quartz. I have now tasked myself with fixing it and returning it to along with all his vinyl.,DJs,dad dj party day technics sl quartz task fix return vinyl
407,Does anyone else setup lights when they practice at home?,DJs,setup light practice home
408,Old DJ Trading Cards,DJs,old dj trading cards
409,"If you're not comfortable yet with transitions, there is absolutely NOTHING wrong with just fading into the next track.",DJs,comfortable transition absolutely wrong fade track
410,"That’s me closing the night after the legendary Ben Clock in Goa, India back in December. Been a year since I started DJing professionally and it’s been a dream. I’m incredibly grateful to this subreddit, it’s taught me a lot",DJs,close night legendary ben clock goa india december year start dj professionally dream incredibly grateful subreddit teach lot
411,Great example of what happened to Grimes at Coachella,DJs,great example happen grimes coachella
412,"Listen to Alive 2007, Seriously",DJs,listen alive seriously
413,First parties after the crisis will be awesome,DJs,party crisis awesome
414,My small come up from last week's DJ Expo,DJs,small come week dj expo
415,Last night I spent a few hours converting my xone23 to a rotary mixer using Dark Bahamas' custom kit. Cheaper alternative to a Rane and better quality than Omnitronic.,DJs,night spend hour convert rotary mixer dark bahamas custom kit cheap alternative rane well quality omnitronic
416,My friend built a stage in my living room last month.,DJs,friend build stage living room month
417,How did he stretch out this one part of the song to transition into the next?,DJs,stretch song transition
418,This made me chuckle..,DJs,chuckle
419,My first ever record just arrived. Just wanted to share the happiness.,DJs,record arrive want share happiness
420,"$450 and a 6 hour round trip drive with 2 pick up locations and I scored all of this (2 brand new M447s, 1 practically brand new Technics 1200 Mk2, and 1 practically brand new Ortofon Nightclub)!!!! Great deals are out there just gotta look hard!",DJs,hour round trip drive pick location score brand new practically brand new technics practically brand new ortofon nightclub great deal get to look hard
421,DJs attempting to identify classic Techno tracks,DJs,dj attempt identify classic techno track
422,"Well, this sucks…",DJs,suck
423,📹 🎥 Hit DJ'ing at Lucas Oil Stadium for B1G Football,DJs,hit lucas oil stadium football
424,How I pull an extra $35k a year + 401k with match from DJing (28 years old),DJs,pull extra year match djing year old
425,"After 8 years of DJing I just finished playing a set in Tokyo. Don't quit, follow your passion, be positive, help others out. Take every gig you can, you never know who you run into.",DJs,year djing finish play set tokyo quit follow passion positive help gig know run
426,Imagine my face when we found this in a crate of old vinyl,DJs,imagine face find crate old vinyl
427,Music Is Not Available Online Forever,DJs,music available online forever
428,This is in the DJ booth at work.,DJs,dj booth work
429,Pretty accurate.,DJs,pretty accurate
430,Note accompanying my record,DJs,note accompany record
431,"During 2022, at least 706 tracks made it to No.1 in one of the 35 electronic genres on Beatport. I've collected them all into a handy playlist along with another 16,000 tracks for the biggest chart of 2022.",DJs,track electronic genre beatport collect handy playlist track big chart
432,The dark paradox of success in the music industry,DJs,dark paradox success music industry
433,So this happened during my set at a festival this weekend.,DJs,happen set festival weekend
434,Best. Request. Ever.,DJs,good request
435,Dj stage i made.,DJs,dj stage
436,"Another ""producer"" stealing tracks...",DJs,producer steal track
437,Citizen DJ: 100 years of free hip hop samples from the US Library of Congress,DJs,citizen dj year free hip hop sample library congress
438,Shout-out to all the DJs out there who can read a room and adjust volume accordingly,DJs,shout dj read room adjust volume accordingly
439,Start them young! 🎧,DJs,start young
