,title,subreddit,processed_title
906,"In honor of Tony Iommi’s Birthday I wanted to try and write a riff in his signature style. It’s not perfect and the drums suck but it’s not about that, it’s about honoring a legend!",musicians,honor tony iommi birthday want try write riff signature style perfect drum suck honor legend
907,That feeling when you mess up the first note...,musicians,feeling mess note
908,This is a video of my band playing one of our original songs at our last show before I move out of the country. I hope y'all enjoy :) Spectrum Hues - Cup o' Jo [Funk/rock],musicians,video band play original song country hope enjoy spectrum hues cup jo funk rock
909,I’ve been trying to write music since high school and I no nothing about music theory or any of that and I have a complete negative bias against myself,musicians,try write music high school music theory complete negative bias
910,Why can’t I get gigs anymore? Is it because of my personality and music taste? ,musicians,gig anymore personality music taste
911,"Looking back on your musical journey, what’s one thing you wish you knew before you started?",musicians,look musical journey thing wish know start
912,Do you practice day of a gig? ,musicians,practice day gig
913,They left 😪🤣🤪,musicians,leave
914,Can I perform Jeff Buckley as a girl?,musicians,perform jeff buckley girl
915,What are some good day jobs for a musician?,musicians,good day job musician
916,What makes someone a great guitarist?,musicians,make great guitarist
917,How do you fight stage fright?,musicians,fight stage fright
918,Kinda hate bars that don't comp beer. That's the post,musicians,kinda hate bar comp beer post
919,"The Great Sound Wave Off Kanagawa, Claydoh/Me, woodburning and stain, 2023",musicians,great sound wave kanagawa claydoh woodburning stain
920,A Force of Nature,musicians,force nature
921,"Wondering about becoming more serious as a musician later in life. Don't need it for the money, but I'm in a place where I can really play music just for me.",musicians,wonder musician later life need money place play music
922,Can anyone tell me who this is?,musicians,tell
923,Got stiffed by a bar in the middle of a gig… and not in a good way!,musicians,get stiffe bar middle gig good way
924,Studio Reshuffle,musicians,studio reshuffle
925,we made a funk album by recording everyone in different rooms of the house! Y’all like this kitchen sax solo by Winston ‘Yuji’ Bell?,musicians,funk album record different room house like kitchen sax solo winston yuji bell
926,"Has anyone had to deal with a creepy or manipulative singer, producer, engineer, or someone behind the scenes ?",musicians,deal creepy manipulative singer producer engineer scene
927,Did I steal this? It keeps occurring to me but I swear I've heard it before.,musicians,steal keep occur swear hear
928,What do you look for in drummers,musicians,look drummer
929,Do you think musical “talent” truly exists?,musicians,think musical talent truly exist
930,I absolutely hate my bandmates,musicians,absolutely hate bandmate
931,"just dropped my first single! i’d love to know what you all think, i don’t really have many friends into this kinda stuff so any feed back is appreciated :)",musicians,drop single love know think friend kinda stuff feed appreciate
932,Reverb is the worst site to sell gear.,musicians,reverb bad site sell gear
933,Describe your music in one word,musicians,describe music word
934,"A piece with notes as small as 1024th, is it even written correctly?",musicians,piece note small write correctly
935,Do young folks aspire to learn instruments and start bands like they used to?,musicians,young folk aspire learn instrument start band like
936,"Sometimes the band springs a drum solo on me during a show...I’m not complaining 🤷🏻‍♂️ I’ll shred anywhere, anytime",musicians,band spring drum solo complain shred anytime
937,"3 Days of playing the Guitar- i can play comfortably between D, G, E and A chords so far!",musicians,day play play comfortably chord far
938,I'm practicing the drums until I get it right! Or close enough...,musicians,practice drum right close
939,This is music from Mayotte and Madagascar in the Indian Ocean (Wawa & Baco Ali),musicians,music mayotte madagascar indian ocean wawa baco ali
940,“Ordinary Pain” by Stevie Wonder (Full video in comments) Enjoy!,musicians,ordinary pain stevie wonder video comment enjoy
941,we're all so fucking cute,musicians,fucking cute
942,playing some gypsy jazz (a Django Reinhardt tune),musicians,play gypsy jazz django reinhardt tune
943,“Run Rudolph Run” by Chuck Berry (a Miles Eberle #piano #cover),musicians,run rudolph run chuck berry miles eberle piano cover
944,Warming up before recording... InKausa Rock Band,musicians,warm recording inkausa rock band
945,The Poison of Social Media,musicians,poison social medium
946,Band is going to professionally record for the first time! Anything we should know?,musicians,band go professionally record time know
947,I should have been a drummer,musicians,drummer
948,Cover:- creep (Radiohead),musicians,creep radiohead
949,I think I just nailed Master of Puppets tone. DoD Looking Glass Drive>KSR Ceres>Prs Archon,musicians,think nail master puppets tone dod looking glass drive ksr ceres prs archon
950,Free guide to recording tracks at home,musicians,free guide record track home
951,Soulful Groove Acoustic Jam,musicians,soulful groove acoustic jam
952,a quick funk loop i did. btw if you’re a guitarist and you struggle with time get a loop pedal. it’ll drive you crazy until you get your timing down.,musicians,quick funk loop btw guitarist struggle time loop pedal drive crazy timing
953,Bass solo duo jam with me and myself... ugg i need human interaction haha. Instagram.com/caryjamhouse,musicians,bass solo duo jam ugg need human interaction haha
954,Am I a dick for wanting payment for my instrumentals?,musicians,dick want payment instrumental
955,A love song for my 3 year old son @theliamkearneyshow,musicians,love song year old son
956,"This was last week. I tried to play the intro to “Nothing Else Matters” by Metallica. I still have a long way to go, but i’m improving my skills each day.",musicians,week try play intro matter metallica long way improve skill day
957,My uncle Qik jamming with my cousins Paulo and Francesco,musicians,uncle qik jam cousin paulo francesco
958,Susanna Hoffs at 55 (from the Bangles),musicians,susanna hoffs bangle
959,Do you have to be close friends with your band mates?,musicians,close friend band mate
960,CD's.....,musicians,cd
961,What's the best advice you received as a musician?,musicians,good advice receive musician
962,What do we do next?,musicians,
963,my band’s song was just featured in the final season of Letterkenny!,musicians,band song feature final season letterkenny
964,"How much theory do most musicians we know, know?",musicians,theory musician know know
965,"Confirmed: From 2024, tracks on Spotify will have to be played 1,000 times before they start earning money",musicians,confirm track spotify play time start earn money
966,What is your minimum skill expectation of a drummer?,musicians,minimum skill expectation drummer
967,I’m not happy with any music I do. I always Write it and scrap it. How do I stop doing this?,musicians,happy music write scrap stop
968,Nominated!,musicians,nominated
969,Best cities for musicians,musicians,good city musician
970,What is the most realistic way to start off making a living as a musician.,musicians,realistic way start make living musician
971,AITA for leaving a band after saying I wouldn't?,musicians,aita leave band say
972,Cher & Madonna Tour 2023,musicians,cher madonna tour
973,"Drum thrones, cause practice makes poofect",musicians,drum throne cause practice make poofect
974,What are you struggling with as a Musician?,musicians,struggle musician
975,is it cool to go knock on someone's door,musicians,cool knock door
976,What is the name of the dots below the quarter notes?,musicians,dot quarter note
977,"How do I ask a band member to leave, who's a long time friend?",musicians,ask band member leave long time friend
978,can anyone tell me what song is this please? i’m begging,musicians,tell song beg
979,I just spent 2 hours doing my makeup and recording a 15 second tik tok over and over and over until my facial expressions and voice inflections were ‘satisfactory’.,musicians,spend hour makeup record second tik tok facial expression voice inflection satisfactory
980,Most approachable instrument for beginners?,musicians,approachable instrument beginner
981,before you go,musicians,
982,First jam in too many years here in Philly with my bros from Beatnik Jr back in the days in LA… good times! 🙌🎶🥁,musicians,jam year philly bros beatnik jr day la good time
983,"If you produce/write music, but can't sing DOUBLE TRACK YOUR VOCALS",musicians,produce write music sing double track vocals
984,Do you love your music?,musicians,love music
985,Rant time! Why is it so hard to find musicians who actually up to something serious and actually DO something?,musicians,rant time hard find musician actually actually
986,How do I get over stage fright?,musicians,stage fright
987,Wind - Naruto Ending 1. The 5/4 timing on this one was quite tricky but managed to get through it! :D,musicians,wind naruto ending timing tricky manage
988,"Here you go! Extended cover of the Bengali folk song, Bhanga Nouka Baite Ailam Gaange, showing both hands. Thanks for the awesome response on my previous post. 🎶🖤",musicians,extended cover bengali folk song bhanga nouka baite ailam gaange show hand thank awesome response previous post
989,Cumberland Gap on clawhammer banjo 😁,musicians,cumberland gap clawhammer banjo
990,10 Things Musicians Should NOT Be Embarrassed About,musicians,thing musicians embarrassed
991,LPT for Guitarists: permanently glue or attach your pick to your fingers so you don't drop/lose them,musicians,lpt guitarist permanently glue attach pick finger drop lose
992,First time ever getting goosebumps while playing,musicians,time get goosebump play
993,Is it just me or do you people feel like playing alone to yourself sounds 300% better than performing in front of people? What can be done?,musicians,people feel like play sound well perform people
994,A Comprehensive Guide to Booking Your Own Tour (DIY Touring),musicians,comprehensive guide book tour diy touring
995,Friend/Bandmate is too confident in our music. How to get him to chill out?,musicians,friend bandmate confident music chill
996,THIS is the problem with the music industry,musicians,problem music industry
997,Here's your argument...,musicians,argument
998,Don't pay Distrokid to add lyrics to Spotify,musicians,pay distrokid add lyric spotify
999,Honest opinions,musicians,honest opinion
10,"I started guitar at 33 & I am now looking back. I’m impressed with my progress of the last four years, but I cannot stop being angry at myself for not starting sooner. Anyone else with a similar predicament?",musicians,start guitar look impressed progress year stop angry start soon similar predicament
14,Think less about what fans can do for you:,musicians,think fan
17,Take breaks. 99 steps forward and 98 steps backwards is still 1 step forward. I’m so close to finishing a song and it’s getting harder and harder to admit when something is good enough to stop. To reiterate to anyone else feeling the same way: take breaks. ,musicians,break step forward step backwards step forward close finish song get hard hard admit good stop reiterate feel way break
18,Tell me about the first time you got on stage (want to hear from everyone but ESPECIALLY singers),musicians,tell time get stage want hear especially singer
23,Take care of your hands,musicians,care hand
27,Growing Fans After Gigs,musicians,grow fans gig
33,Changing up gig habits,musicians,change gig habit
37,I was a musician,musicians,musician
39,"Musicians who play every instrument in the band - I made a sub for this type of ""one-man-band""",musicians,musician play instrument band sub type man band
49,Should I learn to play the Oboe?,musicians,learn play oboe
50,Being in a band is hardly worth the stress. Should I take break from music?,musicians,band hardly worth stress break music
58,Your favorite portable (pocket-size) non-reed instrument for suggestions? ,musicians,favorite portable pocket size non reed instrument suggestion
59,Can I perform one song?,musicians,perform song
60,"I hit over 50k monthly listeners on Spotify in under 2 years as a fully independent artist!! Most people didn’t believe I could do it…and even I doubted myself and wanted to give up many times, but I’m really glad I didn’t! :)",musicians,hit monthly listener spotify year fully independent artist people believe doubt want time glad
66,People asking to sing on stage when playing live,musicians,people ask sing stage play live
68,Marijuana + Music,musicians,marijuana music
75,I’m able to cut 90% of my apartment reverb noise with this set up,musicians,able cut apartment reverb noise set
82,Outdoor gig in rough weather advice,musicians,outdoor gig rough weather advice
86,Band mate has “allegations” against him,musicians,band mate allegation
91,Would you back someone who isn't very good? ,musicians,good
125,How do I tell my band members we should put value to our music and charge for shows,musicians,tell band member value music charge show
129,Can someone please help with a band name?,musicians,help band
131,I play rhythm guitar and I am taking vocal lessons. I am looking for a bud to talk music advice with. Doesn’t matter what instrument you play.,musicians,play rhythm guitar take vocal lesson look bud talk music advice matter instrument play
137,How do you deal with creepy comments from people?,musicians,deal creepy comment people
138,Dealing with post gig soreness?,musicians,deal post gig soreness
143,House shows with grumpy neighbor,musicians,house show grumpy neighbor
153,Most common lie?,musicians,common lie
159,What do you use to keep track of the steps to take to be able to release music?,musicians,use track step able release music
161,"Should I release very racy, heartfelt songs under a new artist name, or my existing one?",musicians,release racy heartfelt song new artist exist
167,How to Let Go of Negative Experiences that Made You Lose Faith in Playing? ,musicians,let negative experience lose faith playing
172,Follow click track or the drummer?,musicians,follow click track drummer
178,(quality) singers are hard to come by,musicians,quality singer hard come
183,Significant other upset at me for shows my band plays at and people try to hug me,musicians,significant upset show band play people try hug
185,"Almost everyone in my local music scene is bad, and I had terrible crimes happen but idk what to do?!",musicians,local music scene bad terrible crime happen idk
190,Survey: how do you study songs and artists to influence your own music?,musicians,survey study song artist influence music
191,Does production seem robotic to anyone?,musicians,production robotic
192,Looking for serious collaboration 😁😁😁,musicians,look collaboration
202,Is this legit? Person wants to write a music blog for me. Idk if it's a scam,musicians,legit person want write music blog idk scam
203,Can I connect my audiocard to this to feed it backing tracks? (along with microphone vocals).,musicians,connect audiocard feed back track microphone vocal
213,"How do PA systems, and in effect my approach to them differ from bar to bar?",musicians,pa system effect approach differ bar bar
226,Feeling Discouraged,musicians,feel discouraged
228,"One member of the band is so bad that he's dragging everyone down, but he's also a good friend. How Can I handle this ?",musicians,member band bad drag good friend handle
230,"What are some tips for no-name bands when it comes to pitching bars, and restaurants gigs?",musicians,tip band come pitching bar restaurant gig
233,I don't know if I'm a good enough composer,musicians,know good composer
234,"Solo artists: what's better--your own name, a pseudonym, or a ""band"" name? ",musicians,solo artist well pseudonym band
241,"Hello fellow musicians, I'm an illustrator and my focus is illustrating musicians and music lovers. If you are interested in having an illustration of you or your band, talk to me. see some of my work. illustrations for 50 to 60 dollars",musicians,hello fellow musician illustrator focus illustrate musician music lover interested have illustration band talk work illustration dollar
250,Need help to remedy amp buzz! Is this ground hum?,musicians,need help remedy amp buzz ground hum
259,"Opinions on the Band name ""Single Celled Banana""?",musicians,opinion band single celled banana
267,I finished my first album and don’t know how to promote it,musicians,finish album know promote
272,Any other singers that hate their singing voice?,musicians,singer hate singing voice
273,"one of the caricatures I made for a band, I hope it works ✍🏾",musicians,caricature band hope work
278,"How hard is it to learn to sight read, if you're a beginner solo performer?",musicians,hard learn sight read beginner solo performer
287,Should I ask to open for an artist?,musicians,ask open artist
289,What does this mean???,musicians,mean
292,Negotiating open mics at random venues(?),musicians,negotiate open mic random venue
294,"Taxes: Do I have to officially register as an official business to write off expenses (instruments, strings, cables, etc). ",musicians,taxis officially register official business write expense instrument string cable etc
301,Best PA for live solo gigs.,musicians,best pa live solo gig
303,“We’ve gotten complaints about the volume.”,musicians,get complaint volume
321,Musicians with bad stage fright. Advice for playing the first time,musicians,musician bad stage fright advice play time
329,I'm sad,musicians,sad
346,Creative disputes,musicians,creative dispute
354,"Any musicians who work blue collar/trade jobs, what has your experience been like?",musicians,musician work blue collar trade job experience like
355,"Last night was EVERYTHING I love about music. Jammed my original, 3.5 Inch Floppy, with musicians who'd never heard it. I gave a quick description (jazzy, campy, slightly painful) and magic happened! My one regret is not explaining to the (mostly younger) audience what a 3.5 inch floppy is...",musicians,night love music jam original inch floppy musician hear give quick description jazzy campy slightly painful magic happen regret explain young audience inch floppy
356,That song (or album) you just released…,musicians,song album release
361,Is mediocrity acceptable in music? ,musicians,mediocrity acceptable music
365,Making a career,musicians,make career
380,Playing by ear but not understanding what I'm playing,musicians,play ear understand play
408,Pouring our heart and soul into our art only to be consumed as entertainment ,musicians,pour heart soul art consume entertainment
410,Is This A Big Middle Finger?,musicians,big middle finger
420,"Most musicians seem to have some form of ADHD, Autism, or Narcissism?",musicians,musician form adhd autism narcissism
430,Ex husband has ruined me in the local musical community ,musicians,ex husband ruin local musical community
434,Fellow male musician friend I gig with sent me an unsolicited nude pic- advice? ,musicians,fellow male musician friend gig send unsolicited nude advice
436,How can I approach my band and tell them it’s good to play venues that aren’t houses or backyards ,musicians,approach band tell good play venue house backyard
439,It's happened twice now,musicians,happen twice
442,Who are the best truly solo artists?,musicians,good truly solo artist
448,i think i made the best song in 15 years,musicians,think good song year
456,Getting paid...,musicians,getting pay
457,Let’s support each other!,musicians,let support
461,Musician unspoken rules/etiquette question,musicians,musician unspoken rule etiquette question
471,Tiktok's Distributor Soundon.global is complete trash,musicians,tiktok distributor complete trash
476,i hesitate when calling music my passion,musicians,hesitate call music passion
489,Question about merch for a new band.,musicians,question merch new band
491,Have you ever performed a gig where another band or performance was in close proximity?,musicians,perform gig band performance close proximity
494,Depression and self critique - survival tips? ,musicians,depression self critique survival tip
495,My first performance is today!!,musicians,performance today
510,Tips on finding bandmates?,musicians,tip find bandmate
513,we need a new platform. NOW!,musicians,need new platform
525,Wedding gig musicians: what are you charging in 2024?,musicians,wedding gig musician charge
527,I've just messed around with Suno AI and am terrified for the future of studio musicians/producers,musicians,mess suno ai terrified future studio musician producer
547,I'm looking for honest feedback that isn't my lovely mothers 😂,musicians,look honest feedback lovely mother
551,"Hi friends! 💔 This is my ""Requiem For Lost Loves"" performed by the Bratislava Orchestra. This will be performed again April 28 in Budapest, and I'll share the video! 🎻 Thanks for listening!... Peace! 🎼❤☮",musicians,hi friend requiem lost love perform bratislava orchestra perform april budapest share video thank listen peace
555,Best way to get gigs as an acoustics live looping artist?,musicians,good way gig acoustics live looping artist
563,Would you settle down with a partner who didn’t love music?,musicians,settle partner love music
564,"I’m going to be sending my music to be mix/mastered at the end of the month then releasing through Distrokid. What’s the best, and legal, way to lock in my artist name as my own?",musicians,go send music mix master end month release distrokid good legal way lock artist
569,daw's impact on the music industry,musicians,daw impact music industry
575,Taylor Swift - 'Shake It Off' (Acoustic Looping Cover) - Brent Brown,musicians,taylor swift shake acoustic looping cover brent brown
583,Would you perform a paid gig for YOUR repeat client with somebody whose music you like and objectively know is a good artist but haven't jammed with before?,musicians,perform pay gig repeat client somebody music like objectively know good artist jam
599,"Few years out of college working a corporate job that I despise, and I’ve realized that music is the only thing that makes me want to get up in the morning…",musicians,year college work corporate job despise realize music thing make want morning
604,Happy Rex Manning Day!,musicians,happy rex manning day
606,best instrument for 1 fully working hand?,musicians,good instrument fully work hand
607,What is the most amount of time per day that professional musicians practice?,musicians,time day professional musician practice
618,What's the best way to say to a  musician that they messed up and did not practice for the gig?,musicians,good way musician mess practice gig
634,"To folks who play shows/gigs regularly, what should a complete newbie know about before getting started?",musicians,folk play show gig regularly complete newbie know getting start
653,I’ve just played guitar for the last time at church,musicians,play guitar time church
682,Famous Musicians,musicians,famous musicians
684,How would you describe your relationship with music?,musicians,describe relationship music
686,Music Tropes or Schticks You Find Annoying Now or Always Did?,musicians,music tropes schtick find annoying
687,more noodling on an original. sorry no title yet. not even sure what this is going to be yet.,musicians,noodle original sorry title sure go
716,sub for people making music for art as opposed to monetary gain?,musicians,sub people make music art oppose monetary gain
727,concert sadness?,musicians,concert sadness
730,Friend got famous and I'm jealous? Advice?,musicians,friend get famous jealous advice
740,Big producers or record execs touching my thighs in public (woman),musicians,big producer record exec touch thigh public woman
759,Have you made someone cry with your music? ,musicians,cry music
762,Help dealing with a patronizing band member,musicians,help deal patronize band member
765,Singer,musicians,singer
769,How do I find people to jam with?,musicians,find people jam
782,Thinking of playing instruments again but afraid I can't do it.,musicians,think play instrument afraid
787,What do you charge to play 2-3 hours solo?,musicians,charge play hour solo
794,"Anyone else hate playing live? Those of you that enjoy it, why? ",musicians,hate play live enjoy
798,What is up with haters on social media?,musicians,hater social medium
801,I feel like it will never be good enough ,musicians,feel like good
803,Aspiring Musician - How to get out there,musicians,aspiring musician
808,Am I being unreasonable?,musicians,unreasonable
812,How long do you start writing for a new project after putting out an album?,musicians,long start write new project put album
816,Where to find Musicians?,musicians,find musicians
818,Who wants to start a girl group ,musicians,want start girl group
819,Rant about local promoter rivalry,musicians,rant local promoter rivalry
833,"How do I get started, and is it worth it?",musicians,start worth
835,am i charging too little for shows?,musicians,charge little show
845,Well known single chord progression songs?,musicians,know single chord progression song
847,Stage Presence for Folk Musicians,musicians,stage presence folk musicians
848,What’s your worst gig ever?,musicians,bad gig
857,5 years ago vs Today,musicians,year ago vs today
860,Rate my corner,musicians,rate corner
885,Undergrad Music Degree - Do I Finish?,musicians,undergrad music degree finish
