,title,subreddit,processed_title
14,"Sister Rosetta Tharpe (born Rosetta Nubin, March 20, 1915 – October 9, 1973) She was the first “original soul sister"" and ""the Godmother of rock and roll"". She was among the 1st popular recording artists to use heavy distortion on her electric guitar, opening the way to the rise of electric blues.",musicians,sister rosetta tharpe bear rosetta nubin march october original soul sister godmother rock roll popular record artist use heavy distortion electric guitar open way rise electric blue
15,What’s your worst gig ever?,musicians,bad gig
16,100% True!,musicians,true
17,Can someone please tell me what key this is in?,musicians,tell key
18,Does anyone just play their instrument for personal enjoyment?,musicians,play instrument personal enjoyment
19,Possible reason on why so many pick up guitar and then quit immediately,musicians,possible reason pick guitar quit immediately
20,“We’ve gotten complaints about the volume.”,musicians,get complaint volume
21,The most hilariously evil thing I’ve ever seen at a concert.,musicians,hilariously evil thing see concert
22,I have officially made revenue from my music!,musicians,officially revenue music
23,"Most musicians seem to have some form of ADHD, Autism, or Narcissism?",musicians,musician form adhd autism narcissism
24,Am I the only one who gets nervous in this situation? I'm all ears 😅​,musicians,get nervous situation ear
25,How not to keep the band together,musicians,band
26,My new favorite instrument.,musicians,new favorite instrument
27,I’m very proud of my basement studio!! Tell me what you think,musicians,proud basement studio tell think
28,promo pics for my White Stripes tribute ❤️🤍❤️,musicians,promo pic white stripes tribute
29,"Hey y’all here’s a video of my band “Fat Mezz” playing Folsom Prison by Johnny Cash. I play bass in this group, usually on electric bass but I pulled the upright out for this video!",musicians,hey video band fat mezz play folsom prison johnny cash play bass group usually electric bass pull upright video
30,"Found this in my AP music theory book, can someone explain what the heck is going on?",musicians,find ap music theory book explain heck go
31,Every artist that wants to do this for a living needs to hear this,musicians,artist want living need hear
32,My best friends and I got a big silly check for winning Battle of the Bands.,musicians,good friend get big silly check win battle bands
33,Mathrock riff 🎸,musicians,mathrock riff
34,Fellow male musician friend I gig with sent me an unsolicited nude pic- advice? ,musicians,fellow male musician friend gig send unsolicited nude advice
35,The Science Of Guitar!,musicians,science guitar
36,Quit Weed and Now What?,musicians,quit weed
37,"Lost my Job as a Circus Bass player because of the outbreak, stuff has been going not so good,been feeling shitty about my playing and life in general. VULFPECK always makes me feel just a little better",musicians,lost job circus bass player outbreak stuff go good feel shitty playing life general vulfpeck make feel little well
38,Just a rant about the worst gig I ever had.,musicians,rant bad gig
39,Got it,musicians,got
40,I hate work,musicians,hate work
41,Friend got famous and I'm jealous? Advice?,musicians,friend get famous jealous advice
42,"I hate when people offer exposure as payment, just a huge insult imo",musicians,hate people offer exposure payment huge insult imo
43,Why are musicians so damn flakey? ,musicians,musician damn flakey
44,i love my dad,musicians,love dad
45,"My home recording set-up circa 1995, 96.",musicians,home recording set circa
46,My band got signed and I had to share.,musicians,band get sign share
47,Unacceptably Honest Songwriting Pro Tip,musicians,unacceptably honest songwrite pro tip
48,What is up with haters on social media?,musicians,hater social medium
49,"Hey all! This is my first post here. I play bass and this is a solo I did over “Superstition” at my most recent gig with Fat Mezz, lmk what you think?",musicians,hey post play bass solo superstition recent gig fat mezz lmk think
50,How to deal with hate as a beginner musician.,musicians,deal hate beginner musician
51,Ed Sheeran testifies in Marvin Gaye plagiarism case: ‘Most pop songs can fit over most pop songs’,musicians,ed sheeran testify marvin gaye plagiarism case pop song fit pop song
52,For players who think they’re too old dream on…,musicians,player think old dream
53,"I hit over 50k monthly listeners on Spotify in under 2 years as a fully independent artist!! Most people didn’t believe I could do it…and even I doubted myself and wanted to give up many times, but I’m really glad I didn’t! :)",musicians,hit monthly listener spotify year fully independent artist people believe doubt want time glad
54,Had an older woman hit on me at my last show,musicians,old woman hit
55,Going through old files - my home studio in 1999.,musicians,go old file home studio
56,"Hybrid Drums/Synth - My first attempt at playing drums and keys at the same time, in the form of a short song. Let me know what you think!",musicians,hybrid drums synth attempt play drum key time form short song let know think
57,What’s your biggest live gig nightmare story,musicians,big live gig nightmare story
58,recently dropped my first album!! appreciate anyone who has the chance to check it out :)),musicians,recently drop album appreciate chance check
59,People asking to sing on stage when playing live,musicians,people ask sing stage play live
60,The Internal Architecture of a Steinway Grand Piano,musicians,internal architecture steinway grand piano
61,Any fellow musician girls get this sort of thing happen to you? What do you do when it does?,musicians,fellow musician girl sort thing happen
62,A delicious way to remember,musicians,delicious way remember
63,Got Any Guest List Spots?,musicians,got guest list spot
64,Am I too old to be chasing a rock star fantasy?,musicians,old chase rock star fantasy
65,"My bands first single just dropped, let me know what you think. Links to Spotify and Apple Music in the comments.",musicians,band single drop let know think link spotify apple music comment
66,HELP! I need comment karma to go live since I changed my account name. Can you help me out?,musicians,help need comment karma live change account help
67,"Dear musicians, I am here to destroy your hearts",musicians,dear musician destroy heart
68,Giving away my guitar!,musicians,give away guitar
69,😂😂😂,musicians,
70,A Paradox. Using a Capo as a Money Clip. It's widely known that musicians don't have money.,musicians,paradox capo money clip widely know musician money
71,Would you settle down with a partner who didn’t love music?,musicians,settle partner love music
72,"“Are You Gonna Go My Way” by Lenny Kravitz on loop station, vocals and double neck guitar.",musicians,go to way lenny kravitz loop station vocal double neck guitar
73,Food for Thought - Advice for Musicians,musicians,food thought advice musician
74,"Musicians of Reddit, please help satisfy my curiosity: what are these holes for?",musicians,musician reddit help satisfy curiosity hole
75,Just a warning for ALL musicians,musicians,warning musician
76,Sinead OConnor has died. May she find the peace that was so elusive in this life.,musicians,sinead oconnor die find peace elusive life
77,Hahhahahaha!,musicians,hahhahahaha
78,Do any of you find it depressing how hard it seems to make a living off music?,musicians,find depress hard living music
79,What does this do?,musicians,
80,Hump day vibes,musicians,hump day vibe
81,Rate my pop song,musicians,rate pop song
82,At the age of 52 working a job that grinds me down...a debt slave... probably working until I expire has inspired me to start writing lo-fi extreme metal influenced music...,musicians,age work job grind debt slave probably work expire inspire start write lo fi extreme metal influence music
83,What’s up with all the bitterness and jealousy? ,musicians,bitterness jealousy
84,What to you is the hardest part about being a musician?,musicians,hard musician
85,My band won our first Battle of the Bands! 🤯,musicians,band win battle bands
86,"D flat is a horrible key to play in. If you ask a band to play in it, you are a prima donna menace to society who is committing a crime against humanity.",musicians,flat horrible key play ask band play prima donna menace society commit crime humanity
87,How many of you have tinnitus?,musicians,tinnitus
88,Time’s up let’s do this,musicians,time let
89,My oldest brothers favourite song my middle brother wrote. We wrote a couple harmonies and played it for him. Rest easy bro 💙,musicians,old brother favourite song middle brother write write couple harmony play rest easy bro
90,Tapping riff 🎸 ,musicians,tap riff
91,"my boyfriend just told me my music is commercial, safe and palatable",musicians,boyfriend tell music commercial safe palatable
92,Would you back someone who isn't very good? ,musicians,good
93,Today’s gig..,musicians,today gig
94,Today I'm the happiest guitarist alive,musicians,today happy guitarist alive
95,Does anyone know if this is a scam or not?,musicians,know scam
97,Do you like my setup? Any suggestions?,musicians,like setup suggestion
98,Be prepared ,musicians,prepared
99,"first day attempting to learn guitar,any of you know any good videos on YouTube? I have autism, so it may be harder for me to learn things",musicians,day attempt learn guitar know good video youtube autism hard learn thing
100,"Apparently, there are so many reasons why people do music and these are some of them but which reason resonates with you the most and why?",musicians,apparently reason people music reason resonate
101,"so i found this audio of me and my best friend improving Randy Newman songs and laughing like idiots from feb 2016. He passed away the following month, and i literally miss him every fucking day. I can’t help but smile listening to it tho. hope this fits here",musicians,find audio good friend improve randy newman song laugh like idiot feb pass away following month literally miss fucking day help smile listen tho hope fit
102,"Talent does matter, personality just matters more.",musicians,talent matter personality matter
103,My friend keeps telling me there's no money in music,musicians,friend keep tell money music
104,Had my first gig the other night,musicians,gig night
105,"After 72 years, first time strummin'!",musicians,year time strummin
106,Easy.,musicians,easy
107,We all remember our first concert. Wait for the band to come in. 🤣😂🤣,musicians,remember concert wait band come
108,Using helium to sing the Chipmunk Song! Enjoy!,musicians,helium sing chipmunk song enjoy
109,Perspective from Schroeder,musicians,perspective schroeder
110,How do I tell my band members we should put value to our music and charge for shows,musicians,tell band member value music charge show
111,Things that the audience does that irritate musician:,musicians,thing audience irritate musician
112,Going from a national touring act back to a local band is difficult,musicians,go national touring act local band difficult
113,Husky barks metal riffs,musicians,husky bark metal riff
114,For the lols,musicians,lol
115,Anyone else feel like maybe they’re not as talented as they think they are?,musicians,feel like maybe talented think
116,Have I found my musical soulmate? Is there such a thing?,musicians,find musical soulmate thing
117,“Bette Davis Eyes”,musicians,bette davis eye
118,"I mixed jazz scatting with modern hip hop flow and autotune, accidentally invented MUMBLE JAZZ",musicians,mix jazz scat modern hip hop flow autotune accidentally invent mumble jazz
119,I transcribed over 1000 songs by ear. AMA,musicians,transcribe song ear ama
120,15 years of music marketing taught me this:,musicians,year music marketing teach
121,Being in a band is hardly worth the stress. Should I take break from music?,musicians,band hardly worth stress break music
122,Why is it normal for people to 'hate' jazz?,musicians,normal people hate jazz
123,Am I too old and shitty to start a band?,musicians,old shitty start band
124,What's the best way to say to a  musician that they messed up and did not practice for the gig?,musicians,good way musician mess practice gig
125,The duality of man,musicians,duality man
126,"Hey, I’m 25yo. I’ve been putting my hobbies together to create things like this. I love creating music and digital art. Let me know what you think!",musicians,hey put hobby create thing like love create music digital art let know think
127,Practicing Walton bagatelle nr 3 (instagram.com/k.beatrix),musicians,practice walton bagatelle nr
128,Do you think this could be a scam?,musicians,think scam
129,Look at this thrift store find! 10 bucks! I have yet to find out if it works.,musicians,look thrift store find buck find work
130,Please can someone tell me what song this may be?,musicians,tell song
131,Most new rock acts are focusing on the wrong thing,musicians,new rock act focus wrong thing
132,"Dreams, but make it a decade later.🧡✨",musicians,dream decade later
133,NYC INDIE BAND SEEKING MUSICANS,musicians,nyc indie band seeking musican
134,"I’m a female musician, men keep calling me hun. Sweetie. Love… UGH",musicians,female musician man call hun sweetie love ugh
135,Relatable,musicians,relatable
136,How many instruments do you play?,musicians,instrument play
137,How can I be a rockstar without actually doing anything? What should I play??,musicians,rockstar actually play
138,Local realtors hosting VIP party want me to perform 3 hours of live acoustic music for free?,musicians,local realtor host vip party want perform hour live acoustic music free
139,I feel like it will never be good enough ,musicians,feel like good
140,Performed at my first Open Mic night tonight.,musicians,perform open mic night tonight
141,Why do musicians have a tendency to ghost each other? ,musicians,musician tendency ghost
142,Radiohead - weird fishes cover,musicians,radiohead weird fish cover
143,something funky,musicians,funky
144,What is the most money you've ever made all at once from music?,musicians,money music
145,THIS DID SO WELL IM DOING IT AGAIN SHARE YOUR MUSIC WITH ME FOR SOME FEEDBACK (1 SONG PER ARTIST),musicians,im share music feedback song artist
146,Did my first open mic tonight.,musicians,open mic tonight
147,"Had such an incredible experience today of playing live 🎶 at the stadium of the Saracens 🏉 9000 people came to the game and plenty sang along, great start to 2022! 😊",musicians,incredible experience today play live stadium saracens people come game plenty sing great start
148,a lullaby I wrote a while back,musicians,lullaby write
149,Have you made someone cry with your music? ,musicians,cry music
150,Facts.,musicians,fact
151,Wear earplugs.,musicians,wear earplug
152,"For original bands, I think shorter sets are almost always better than longer ones",musicians,original band think short set well long one
153,Dream by me,musicians,dream
154,I about choked on my drink when I saw this. Lol,musicians,choke drink see lol
155,This is how they treat you if you spend money there too,musicians,treat spend money
156,"In 1974, Tom Petty loaded up a van with his bandmates and headed to Los Angeles to pursue a music career. Where do people load up their vans to move to for a music career today?",musicians,tom petty load van bandmate head los angeles pursue music career people load van music career today
157,Riptide cover,musicians,riptide cover
158,Some harmonized shredding i did. Gf calls it “the under water part in a mega man x game”,musicians,harmonized shredding gf call water mega man game
159,How do modern musicians REALLY make their money?,musicians,modern musician money
160,"“Redbone” by Childish Gambino, cover on Loop-station and Double-Neck",musicians,redbone childish gambino cover loop station double neck
161,"random - but i recently splatter painted my bass cabinet, and i think it looks pretty cool.",musicians,random recently splatter paint bass cabinet think look pretty cool
162,Should I accept this gig?? Doesn't seem alright with me.,musicians,accept gig alright
163,I’m Broke,musicians,broke
164,"20,000 streams of new EP on Spotify, thats 3 cents!",musicians,stream new ep spotify cent
165,"I truly hope that all the musicians who now can tele-work will utilize this time at home to create some amazing music over the next few weeks. The divided world needs to be connected now more than ever, and music has always been the great uniter. Stay productive, stay safe, and keep creating!",musicians,truly hope musician tele work utilize time home create amazing music week divided world need connect music great uniter stay productive stay safe create
166,I just got offered to play Guitar in a church. Should I take it?,musicians,get offer play guitar church
167,here’s a lil mathrock riff i made last night!,musicians,lil mathrock riff night
168,I (22F) look gross here and I sound bad unplugged but I tried to improvise a little on bass,musicians,look gross sound bad unplugged try improvise little bass
169,Life hack: get your self a partner that has the same passions,musicians,life hack self partner passion
170,Does Your Music Suck?,musicians,music suck
171,Name that artist/group!,musicians,artist group
172,It's feels so amazing to be back on a stage!! Going to be a great summer!!!,musicians,feel amazing stage go great summer
173,Playing a proposal tomorrow! Came up with this. Thanks for listening!,musicians,play proposal tomorrow come thank listen
174,Searching for a musician,musicians,search musician
175,Suss music Professor,musicians,suss music professor
176,"A Bengali Folk song played on a nylon string guitar tuned in dotara tuning( the G is tuned down half step so that the 2nd and 3rd strings can form a power chord which carries the basic rhythm forward, in this case a 6 beat cycle called dadra similar to the Western 6/8 cycle) Hope you like it! 🎼",musicians,bengali folk song play nylon string guitar tune dotara tuning tune half step string form power chord carry basic rhythm forward case beat cycle call dadra similar western cycle hope like
177,Is anyone else excited about Super Mario 64 coming to the Nintendo switch ??,musicians,excited super mario come nintendo switch
178,Little something I wrote tonight.,musicians,little write tonight
179,I desperately need to perform live - but how do I break in?,musicians,desperately need perform live break
180,My original composition I made when I was 13 called 'David's Anointing'. I've explained each section using timestamps in the description below. Hope you like it! :D,musicians,original composition call david anointing explain section timestamp description hope like
181,Heard myself on the radio for the first time,musicians,hear radio time
182,is this a guitar?,musicians,guitar
183,Practice space/home studio,musicians,practice space home studio
184,Important Advice for Musicians,musicians,important advice musician
185,"This is Joe Domenech. Joe preys on musicians that need marketing, promising them that he can help bring numbers up, using ""31 Records"" as a front. Joe will spend all the time in the world begging you to send him money. Once you do, Joe disappears. Don't be like Joe. Share to spread awareness.",musicians,joe domenech joe prey musician need marketing promise help bring number records joe spend time world beg send money joe disappear like joe share spread awareness
186,back pain from many hours playing guitar,musicians,pain hour play guitar
187,I am sure y'all feel the same way,musicians,sure feel way
188,Riptide cover official by me. On my YouTube as well,musicians,riptide cover official youtube
189,A little morning improv today. Sometimes you just gotta let the notes flow.,musicians,little morning improv today get to let note flow
190,😶‍🌫️,musicians,
191,if your goal is to go viral online you're wasting your time & ours,musicians,goal viral online waste time
192,wrote a dissonant breakdown and now it's my son's theme music 🔥☠️🔥,musicians,write dissonant breakdown son theme music
193,I have a theory that being a great musician is reliant on being interested in other things.,musicians,theory great musician reliant interested thing
194,help me convince my bandmates to record in a studio,musicians,help convince bandmate record studio
195,I played drums at a jam session for the first time in a looong time,musicians,play drum jam session time looong time
196,"Not sure if this sub is the place for this but my friend (on the left) died of an OD a few years ago. I think about him a lot & this is my fav pic of us. We jammed together often. 🌹🕊️🎶 Rest up, bud. Guitar isn’t the same without you.",musicians,sure sub place friend left die od year ago think lot fav pic jam rest bud guitar
197,i finally got a guitar!!,musicians,finally get guitar
198,"if it makes you happy, do it. just do it",musicians,make happy
199,my favorite pic from a feature i did with my friends Zeppelin tribute :-),musicians,favorite pic feature friend zeppelin tribute
200,Drum beat Friday 🥁,musicians,drum beat friday
201,Here's a quick and easy trick to help you lose your will to live!,musicians,quick easy trick help lose live
202,Free food!,musicians,free food
203,Is anyone else frustrated by the fact that YouTube's advertising seems to think that all musicians are beginners? Or am I the only one that's constantly asked if I wanna play like Metallica?,musicians,frustrate fact youtube advertising think musician beginner constantly ask wanna play like metallica
204,From my last show!🎸🎸❤️❤️,musicians,
205,New gear- Got the Focusrite Scarlett solo and AudioTechnica AT2020 for $100 total,musicians,new get focusrite scarlett solo audiotechnica total
206,I've just messed around with Suno AI and am terrified for the future of studio musicians/producers,musicians,mess suno ai terrified future studio musician producer
207,Exposure just doesn’t pay the bills.,musicians,exposure pay bill
208,Old man playing Western classics.,musicians,old man play western classic
209,this one is called “dogs”,musicians,call dog
210,"One member of the band is so bad that he's dragging everyone down, but he's also a good friend. How Can I handle this ?",musicians,member band bad drag good friend handle
211,Had a rough gig tonight.,musicians,rough gig tonight
212,Drummer Duck goes metal,musicians,drummer duck go metal
213,Short clip of me playing 'The Raising Fighting Spirit' (Naruto) on piano! Hope you like it :D,musicians,short clip play raising fighting spirit naruto piano hope like
214,Why do musicians seem to have such a hard time managing their egos?,musicians,musician hard time manage ego
215,"played my first open mic, everything that went wrong could- story in comments",musicians,play open mic go wrong story comment
216,How many of you guys play multiple instruments?,musicians,guy play multiple instrument
217,concert sadness?,musicians,concert sadness
218,Stop blaming the gear!,musicians,stop blame gear
219,"So after losing my Job as Circus Bass player (cause of Covid-19) I finally got a chance to audition for a Different Circus! Got asked to Audition with this track, What do you guys think ?",musicians,lose job circus bass player cause finally get chance audition different circus get ask audition track guy think
220,A little bass solo inspired by Cliff Burton,musicians,little bass solo inspire cliff burton
221,"All about that bass, for some",musicians,bass
222,Working on a new song idea and came up with this fun noodly riff!,musicians,work new song idea come fun noodly riff
223,What half the jam session is for the drummer.,musicians,half jam session drummer
224,How would you count this beat,musicians,count beat
225,"Live in the US and have a band? The State Dept. has applications open right now for American Music Abroad. Bands get paid to tour the world and do performances, workshops and more. I've done it a bunch and can answer questions.",musicians,live band state dept application open right american music abroad band pay tour world performance workshop bunch answer question
226,The den 🤘😈,musicians,den
227,I really miss music venues and playing shows. Pandemics suck.,musicians,miss music venue playing show pandemic suck
228,Musician Humor,musicians,musician humor
229,"For musicians who are not educated at a school, but are self taught: what concept from music theory has helped you the most?",musicians,musician educate school self teach concept music theory help
230,What 20 years of playing in venues has taught me:,musicians,year play venue teach
231,I want to be a professional musician but fear I am too old.,musicians,want professional musician fear old
232,Why don't we listen to original music?,musicians,listen original music
233,Never meet your heroes,musicians,meet hero
234,Pretty solid gift from the in-laws!,musicians,pretty solid gift law
235,"My band ""Hunter Thomas"" killed it last weekend.",musicians,band hunter thomas kill weekend
236,"this one is called ""driving dog"". I wrote it because it looked like the dog was driving the car, which i found very inspiring.",musicians,call drive dog write look like dog drive car find inspiring
237,I can't play drums but... I can play rooftops thanks to technology.,musicians,play drum play rooftop thank technology
238,"Pretty ironic, my bass cord went into a treble clef shape",musicians,pretty ironic bass cord go treble clef shape
239,"After years of depression, I'm starting to patch myself up. I finally want to live. A really good feeling that I try to express in this song. „Needle And Threat“ by me.",musicians,year depression start patch finally want live good feeling try express song needle threat
